{
  "id": "2026-climb-pr",
  "name": "2026 Climb PR",
  "status": "completed",
  "start": "2026-05-04",
  "goal": "Climb PR attempt in France, Aug 8 2026. 14-week build: base, VO2max, specificity, taper.",
  "blocks": [
    { "id": 1, "name": "Block 1", "focus": "Base & Threshold",
      "purpose": "Build aerobic base, raise FTP floor with sweet spot and threshold work. Establish strength routine and cadence pattern." },
    { "id": 2, "name": "Block 2", "focus": "VO2max Build",
      "purpose": "Raise the 5-min power ceiling — the direct limiter for your climb PR. VO2 intervals, over-unders, climb sims." },
    { "id": 3, "name": "Block 3", "focus": "Specificity",
      "purpose": "Climb-specific variable efforts and race-pace work. Train the exact surge-recovery pattern of a mixed climb." },
    { "id": 4, "name": "Block 4", "focus": "Peak & Taper",
      "purpose": "Sharpen with short high-quality intervals, reduce volume, then PR attempt in France." }
  ],
  "weeks": [
    { "week": 1, "label": "W1 Base", "block": 1,
      "days": ["REST", "EASY45", "Z2_60", "SS_2x15", "REST", "LONG_Z2", "EASY45"] },
    { "week": 2, "label": "W2 Base", "block": 1,
      "days": ["REST", "SS_2x15", "Z2_60", "THR_2x12", "REST", "LONG_Z2", "EASY45"] },
    { "week": 3, "label": "W3 Build", "block": 1,
      "days": ["REST", ["SS_3x10","STR_BW"], "Z2_60", ["THR_2x15","STR_BW"], "REST", "LONG_Z2_LONG", "EASY45"] },
    { "week": 4, "label": "W4 Recovery", "block": 1,
      "days": [["SS_3x8","STR_BW"], "Z2_60", ["THR_2x10","STR_BW"], "REST", "EASY45", "HALF_MONTY", "REST"] },
    { "week": 5, "label": "W5 VO2 Intro", "block": 2,
      "days": [["VO2_5x3","STR_BW"], "Z2_60", ["THR_2x10","STR_BW"], "REST", "LONG_Z2", "REST", "EASY45"] },
    { "week": 6, "label": "W6 VO2 Build", "block": 2,
      "days": [["VO2_4x4","STR_BW"], "Z2_60", ["OU_3x10","STR_GYM"], "REST", "LONG_Z2", "REST", "EASY45"] },
    { "week": 7, "label": "W7 VO2 Peak", "block": 2,
      "days": [["VO2_5x3","STR_BW"], "Z2_60", ["OU_4x8","STR_GYM"], "REST", "LONG_VO2", "CANNES_SHAKEOUT", "CANNES_SUN_AM"] },
    { "week": 8, "label": "W8 Cannes Camp", "block": 2,
      "days": ["CANNES_VENCE_SS", "CANNES_Z2_LOCAL", "REST", "CANNES_ESTEREL", "CANNES_TANNERON_AE", "REST", "REST"] },
    { "week": 9, "label": "W9 Taper + Retest", "block": 2,
      "days": ["REST", "EASY45", "Z2_60", "OPENERS", "HALF_MONTY", "REST", "EASY45"] },
    { "week": 10, "label": "W10 Specific", "block": 3,
      "days": [["CLIMB_2x12","STR_BW"], "Z2_60", ["RACE_3x6","STR_GYM"], "REST", "LONG_Z2_LONG", "REST", "EASY45"] },
    { "week": 11, "label": "W11 Specific Peak", "block": 3,
      "days": [["VO2_30_15","STR_BW"], "Z2_60", ["CLIMB_3x10","STR_GYM"], "REST", "LONG_VO2", "REST", "EASY45"] },
    { "week": 12, "label": "W12 Recovery", "block": 3,
      "days": [["RACE_3x5","STR_BW"], "Z2_60", "EASY45", "REST", "EASY45", "LONG_Z2", "REST"] },
    { "week": 13, "label": "W13 Sharpen", "block": 4,
      "days": [["SHARP_5x2","STR_BW"], "EASY45", ["RACE_3x5","STR_BW"], "REST", "EASY45", "Z2_60", "REST"] },
    { "week": 14, "label": "W14 PR Week", "block": 4,
      "days": ["SHARP_5x2", "EASY30", "TEST_5MIN", "REST", "OPENERS", "PR_DAY", "REST"] }
  ]
}
